category,link,price,time,title
Auriculares y microfonos,https://www.fullh4rd.com.ar/prod/8681/auriculares-hyperx-cloud-ii-red,14290.00,2020-11-2 20:15,Auriculares hyperx cloud ii red
Auriculares y microfonos,https://www.fullh4rd.com.ar/prod/10164/auriculares-hyperx-cloud-alpha-red-pc-ps4-xbox,15690.00,2020-11-2 20:15,Auriculares hyperx cloud alpha red pc ps4 xbox
Auriculares y microfonos,https://www.fullh4rd.com.ar/prod/7835/auriculares-logitech-h390-usb,4199.00,2020-11-2 20:15,Auriculares logitech h390 usb
Auriculares y microfonos,https://www.fullh4rd.com.ar/prod/9181/auriculares-hyperx-cloud-stinger-gaming-black-pc-ps4,6070.00,2020-11-2 20:15,Auriculares hyperx cloud stinger gaming black pc ps4
Auriculares y microfonos,https://www.fullh4rd.com.ar/prod/14855/auriculares-jbl-endurance-run-black,2410.00,2020-11-2 20:15,Auriculares jbl endurance run black
Auriculares y microfonos,https://www.fullh4rd.com.ar/prod/13234/auriculares-xiaomi-mi-airdots-black-bluetooth,2299.00,2020-11-2 20:15,Auriculares xiaomi mi airdots black bluetooth
Auriculares y microfonos,https://www.fullh4rd.com.ar/prod/16548/auriculares-pcbox-mdq-1101-con-microfono,1248.00,2020-11-2 20:15,Auriculares pcbox mdq-1101 con microfono
Auriculares y microfonos,https://www.fullh4rd.com.ar/prod/15101/auriculares-trust-quasar,2071.00,2020-11-2 20:15,Auriculares trust quasar
Auriculares y microfonos,https://www.fullh4rd.com.ar/prod/16586/auriculares-hyperx-cloud-chat-xbox,2696.00,2020-11-2 20:15,Auriculares hyperx cloud chat xbox
Auriculares y microfonos,https://www.fullh4rd.com.ar/prod/16506/auriculares-con-microfono-noganet-st-spire-usb,4699.00,2020-11-2 20:15,Auriculares con microfono noganet st-spire usb
Auriculares y microfonos,https://www.fullh4rd.com.ar/prod/15049/auriculares-trust-carus-ps4-gxt322b,5890.00,2020-11-2 20:15,Auriculares trust carus ps4 gxt322b
Auriculares y microfonos,https://www.fullh4rd.com.ar/prod/10994/auriculares-corsair-hs50-carbon,12502.00,2020-11-2 20:15,Auriculares corsair hs50 carbon
Auriculares y microfonos,https://www.fullh4rd.com.ar/prod/11702/auriculares-logitech-g-pro-x-gaming,20445.00,2020-11-2 20:15,Auriculares logitech g pro x gaming
Auriculares y microfonos,https://www.fullh4rd.com.ar/prod/12485/auriculares-hyperx-cloud-flight-wireless,30390.00,2020-11-2 20:15,Auriculares hyperx cloud flight wireless
Auriculares y microfonos,https://www.fullh4rd.com.ar/prod/15885/auriculares-hyperx-cloud-chat-ps4,3490.00,2020-11-2 20:15,Auriculares hyperx cloud chat ps4
Auriculares y microfonos,https://www.fullh4rd.com.ar/prod/14030/auriculares-gaming-pulse-g100-rgb-3d-71-thermaltake,7469.00,2020-11-2 20:15,Auriculares gaming pulse g100 rgb 3d 7.1 thermaltake
Auriculares y microfonos,https://www.fullh4rd.com.ar/prod/11894/auriculares-logitech-g332-pc-ps4-celu-xbox,9044.00,2020-11-2 20:15,Auriculares logitech g332 pc ps4 celu xbox
Auriculares y microfonos,https://www.fullh4rd.com.ar/prod/15887/auriculares-jbl-tune-600-blue,11680.00,2020-11-2 20:15,Auriculares jbl tune 600 blue
Auriculares y microfonos,https://www.fullh4rd.com.ar/prod/15889/auriculares-hyperx-cloud-stinger-core,6899.00,2020-11-2 20:15,Auriculares hyperx cloud stinger core
Auriculares y microfonos,https://www.fullh4rd.com.ar/prod/17106/auriculares-astr0-a10-xbox-ps4-nint-pc-mac,8390.00,2020-11-2 20:15,Auriculares astr0 a10 xbox ps4 nint pc mac
Auriculares y microfonos,https://www.fullh4rd.com.ar/prod/16179/auriculares-corsair-hs60-pro-surround-usb-carbon,15170.00,2020-11-2 20:15,Auriculares corsair hs60 pro surround usb carbon
Auriculares y microfonos,https://www.fullh4rd.com.ar/prod/15054/auriculares-trust-cobra-multi-plataforma-gxt408,3590.00,2020-11-2 20:15,Auriculares trust cobra multi plataforma gxt408
Auriculares y microfonos,https://www.fullh4rd.com.ar/prod/14672/auriculares-corsair-hs45-carbon,11590.00,2020-11-2 20:15,Auriculares corsair hs45 carbon
Auriculares y microfonos,https://www.fullh4rd.com.ar/prod/16209/auriculares-philips-in-ear-shs3305bk-10-deportivos,1560.00,2020-11-2 20:15,Auriculares philips in ear shs3305bk/10 deportivos
Auriculares y microfonos,https://www.fullh4rd.com.ar/prod/11481/auriculares-hyperx-stinger-core-ps4,6539.00,2020-11-2 20:15,Auriculares hyperx stinger core ps4
Auriculares y microfonos,https://www.fullh4rd.com.ar/prod/16592/auriculares-hyperx-cloud-stinger-for-ps4,6679.00,2020-11-2 20:15,Auriculares hyperx cloud stinger for ps4
Auriculares y microfonos,https://www.fullh4rd.com.ar/prod/9687/auriculares-logitech-g533-gaming,15990.00,2020-11-2 20:15,Auriculares logitech g533 gaming
Auriculares y microfonos,https://www.fullh4rd.com.ar/prod/12568/auriculares-bluetooth-twins-noga-ng-btwins-2,1299.00,2020-11-2 20:15,Auriculares bluetooth twins noga ng-btwins 2
